Organizing Your Remote Office for Maximum Productivity,"Working remotely gives you amazing freedom, but how you set up your office makes all the difference. To maximize your productivity, you need to be able to easily transition from home life to work life and back again. From setting up your physical space to managing your digital life, author and productivity expert Paula Rizzo can help you get more done when working remotely. Learn to harness your personal productivity style to create an intentional workspace; adapt any room, regardless of size; choose the right equipment and technology; present better during video meetings; organize your documents and files; and set boundaries with those you share space with. Plus, learn to plan ahead to take your workspace on the road—wherever business takes you.",Course,2021-03-31 08:10 UTC,N/A,false,N/A,
Working with Difficult People,"<p>In every workplace, you're likely to encounter colleagues who are more difficult to work with than others. But before you rush to judgment, you should determine if and how you might be contributing to the situation, and what you can do to help.</p><p>In this course, join psychologist Dr. Emily Anhalt as she shows you how to navigate and communicate with people who you find challenging to deal with at work. Pause and reflect on your role in challenging work situations to uncover how empathy can help you work better with others. Emily shares strategies to respond to a wide variety of particularly challenging work situations, including with people whose behavior is negative, absent, competitive, and passive-aggressive. By the end of this course, you’ll be prepared with new skills and practical strategies to have an effective conversation with someone you find difficult to work with.</p>",Course,2024-08-24 07:27 UTC,N/A,false,N/A,
Succeeding as an LGBT Professional,"Even in places where discrimination is illegal, there are still nuances and complexities involved in being openly LGBT at work. In this course, best-selling business author, consultant, and educator Dorie Clark shows you how to navigate them with aplomb and build a successful and thriving career. Dorie discusses how to harness the benefits of your identity and identify and overcome any limiting beliefs you may hold. She goes over pros and cons of coming out in your job search or on the job. Dorie covers ways to handle well-meaning coworkers with grace and how to connect with other LGBT professionals. She shares strategies to overcome challenges such as a very conservative company or industry, hostile coworkers, or the complexities of coming out as transgender.",Course,2022-01-04 22:32 UTC,N/A,false,N/A,
SOLIDWORKS: Modeling Gears,"Do you need to design and build gears for work, study, or a hobby? In this course, instructor Ryan Krawchuk covers the basics of mechanical gears, gives a hands-on lesson on modeling a spur gear using SOLIDWORKS, and then describes how to create a simple assembly. Ryan begins with a description of spur gears, helical gears, and others gears, as well as their respective applications. He covers key gear design attributes and nomenclature. Ryan steps you through spur gear equations, for both metric and English measurement systems, then goes through each step in modeling a spur gear. Once your gear model is complete, he shows you how to design the mounting plate that gears sit on, how to insert gears and mounting plates into your assembly, and how to use concentric and coincident gear mates. He discusses how to use a series of gear mates to allow gears to rotate dynamically to one another, then concludes by showing you how to animate your assembly with a SOLIDWORKS motion study.",Course,2021-05-28 22:09 UTC,N/A,false,N/A,
Power BI: Integrating AI and Machine Learning,"Power BI is a powerful data analytics and visualization tool that allows business users to monitor data, analyze trends, and make decisions. Every month, Microsoft pushes Power BI updates out to the end users, and the growth of Power BI is a key part of Microsoft’s current strategy. This course showcases existing AI and machine learning capabilities available directly in accessible Power BI functionalities. Data analytics and business analysis expert Helen Wall gives you a useful overview of Power BI, then dives into the steps to configure Power Query and your data model. Helen steps through analyzing single variables and shows you the tools and techniques to measure relationships between variables. She shows you visuals that you can use to pose and answer questions in Power BI, explains useful techniques to enhance your analysis of time series data, and walks you through some best practices for sharing your analysis.",Course,2021-09-22 14:22 UTC,N/A,false,N/A,
Excel 2016 Essential Training,"Start mastering Excel, the world's most popular and powerful spreadsheet program, with Excel expert Dennis Taylor. Learn how to best enter and organize data, perform calculations with simple functions, work with multiple worksheets, format the appearance of your data and cells, and build charts and PivotTables. Other lessons cover the powerful IF, VLOOKUP, and COUNTIF family of functions; the Goal Seek, Solver, and other data analysis tools; and automating tasks with macros.",Course,2016-06-15 01:13 UTC,N/A,false,N/A,
Social Selling with LinkedIn,"Technology like LinkedIn has fundamentally changed the way people communicate, and the way they buy and sell. Learn how to use LinkedIn to get in touch with your buyers and start relationships you can use to build trust and accelerate sales. B2B marketing expert Gabe Villamizar explains how to use LinkedIn for social selling. First, he discusses the importance of being selective with keywords, images, and messaging to ensure you have a buyer-centric LinkedIn profile. Next, he shows you how to use LinkedIn to research and find buyers in your target market. Then he explains how and when to take the conversation offline, and how to measure the success of your social selling efforts on LinkedIn using key metrics.",Course,2020-06-25 15:19 UTC,N/A,true,N/A,
The Practicing Photographer,"<p>In <i>The Practicing Photographer</i>, photographer and teacher Ben Long shares a weekly serving of photographic instruction and inspiration. Each installment focuses on a photographic shooting scenario, a piece of gear, or a software technique. Each one concludes with a call to action designed to inspire you to pick up your camera (or your mouse or smartphone) to try the technique for yourself.</p><p>Note: Because this is an ongoing series, viewers will not receive a certificate of completion.</p>",Course,2025-03-03 10:59 UTC,N/A,false,N/A,
SketchUp: Modeling from Photos,"Not sure which furniture will mesh with your living room design? With SketchUp, a 3D modeling program, you can take your architectural and material design ideas from your head to your screen. In this course, instructor Scott Onstott shows you how to use the free version of SketchUp to explore possible design scenarios using photos and 3D models. Scott explains how to match SketchUp's coordinate system to the perspective implied in multiple photographs, allowing you to use photos to create 3D models. He demonstrates how to model objects like fireplaces, windows, doors, and walls from photo models, alter photo textures in SketchUp and retouch them in Photoshop, and model new textured objects. He also illustrates how to use a combination of layers, scenes, and materials to explore design alternatives.",Course,2017-07-30 14:57 UTC,N/A,false,N/A,
Designing the Ultimate Man-Cave or She-Shed Design in SketchUp,"We all want a room to call our own. Personal structures like man caves and she sheds give you a hideaway from life stresses. Do you want a light and airy garden structure to curl up with a good book or to enjoy conversation with a friend, or would a lounge with a minibar where you can watch the game while working on your motorcycle be your idea of a good time? SketchUp, ""the easiest, most fun, entirely free 3D drawing tool in the world,"" is the perfect program to design your unique space. Join Scott Onstott in this course, as he shows how to model an existing structure like a garage and transform it into a personal sanctuary with SketchUp's intuitive 3D toolset. Discover how to model walls, doors, windows, furniture, and even a private bathroom, and finesse your design with lighting and shading.",Course,2020-04-23 23:11 UTC,N/A,false,N/A,
Nano Tips for Effortless Influence with Shadé Zahrai,"Welcome to our Nano Tips series, where LinkedIn Learning creators deliver impactful lessons in literally seconds. In this course, peak performance researcher and behavioral strategist to Fortune 500 companies Shadé Zahrai shows you how to exude effortless influence. She starts with outlining the basics of influence, followed by sharing key influence tactics—leveraging social proof, offering choices, and influencing with emotional intelligence. Shadé then takes it up a level with some pro-level influence techniques, explaining how to influence those with greater authority and how to sway skeptics.",Course,2024-08-05 08:52 UTC,N/A,false,N/A,
Selling with Empathy during Uncertain Times,"It's only natural that uncertain economic conditions create anxiety for salespeople and buyers alike. But a shift in your focus can help you quiet the fear and show up for customers when they need you most. Join Lisa McLeod as she helps you navigate selling in uncertain times. Lisa and her team have coached hundreds of sales professionals through economic turbulence, product launch failures, and other difficulties. In this course, she provides an empathetic, customer-centric approach to sales that will help you connect with customers, solve their most urgent problems, and identify the most authentic version of yourself. Use these tips to rise to the challenge and turn uncertain times into an opportunity to succeed.",Course,2021-02-01 08:04 UTC,N/A,false,N/A,
Gemba Kaizen: A Commonsense Approach to Continuous Improvement (Blinkist Summary),"<i>Gemba Kaizen</i> is an introduction to the Japanese business philosophy of Kaizen, a low-cost strategy that revolutionizes working standards to reduce waste and increase efficiency. Author Masaaki Imai reveals the aspects of Kaizen that are crucial to building lean business strategies. In this audio-only summary of Imai's popular book, you can explore the definition of Kaizen and the five Ss (5S) of workplace organization, discover the importance of flexible standards and self-discipline, and learn a visualization process for quicker troubleshooting and stronger employee motivation. Plus, find out why Kaizen is incomplete without strong leadership.

<br><br>Note: This audiobook summary was produced by <a href=""https://www.blinkist.com/?utm_source=linkedinlearning&utm_medium=partner&utm_campaign=Gemba-Kaizen-A-Commonsense-Approach-to-Continuous-Improvement-Blinkist"" target=""_blank"">Blinkist</a>. We are pleased to host this content in our library.",Course,2021-03-11 23:59 UTC,N/A,false,N/A,
Microsoft Project 2013 Essential Training,"Follow along with author Bonnie Biafore as she shows you how to better manage your project's deadlines, tasks, and resources with Microsoft® Project 2013. This course covers setting up project files, creating tasks, assigning resources, working with views, and using baseline calculations to track progress.  Plus, learn how to report project information and share it with others.",Course,2017-02-04 03:37 UTC,N/A,false,N/A,
Material Requirements Planning (MRP) Strategies in SAP,"Discover how to calculate the materials required for product manufacturing with greater accuracy and speed within SAP. The SAP ERP tool has many different material requirements planning (MRP) strategies that are preconfigured and ready to implement; you just need to learn how to choose the right one. This course guides you through the configuration options and business processes behind the make-to-stock (MTS), make-to-order (MTO), and component-level MRP strategies. You can also explore a hybrid strategy for multi-use materials, for use with components in production and spare parts. Once you have completed this course, you should be able to pair the right material requirements planning strategy for every possible business scenario.<br><br>This course was created by Michael Management. We are pleased to offer this training in our library.",Course,2021-12-24 08:51 UTC,N/A,false,N/A,
Accounting Foundations: Budgeting (2015),"Growing companies don't have a long history to guide management decisions. But they can't go on reacting to one crisis after another without a plan. Such companies need to harness the power of budgeting to identify and solve problems on paper before they arise in the real world.<br><br>

This course covers purchase budgets, production budgets, hiring budgets, overhead budgets, and cash budgets. Professors Jim and Kay Stice help you weigh the impact of strict versus more moderate budgeting on employee morale, and show how budgets pay off in the future, when you can use them to evaluate your business performance.",Course,2018-11-08 15:18 UTC,N/A,false,N/A,
Running a Profitable Business: Calculating Breakeven,"<p>Starting a business can be pricey. Breakeven analysis and cost-volume-profit analysis will help you understand when—and if—your business will start to recover those costs and begin making a profit. Understanding your breakeven point will help you to determine how much you need in revenue to keep your business going. Accounting professors Jim and Kay Stice walk through the breakeven equation, and cover types of costs, contribution margin, breakeven point, and net income. They also explain what each term means, and the importance of each, and offer examples from popular real-world companies. </p><p>Want to learn more? Learn about three types of accounting—financial, managerial, and income tax—in their <i>Accounting Foundations</i> course. </p><p>This course is part of a <a href=""https://www.linkedin.com/learning/paths/finance-for-managers-professional-certificate-by-linkedin-learning"" target=""_blank"">Professional Certificate</a> from LinkedIn Learning.</p>",Course,2018-05-01 03:56 UTC,N/A,false,N/A,
Neural Networks and Convolutional Neural Networks Essential Training,"Take a deep dive into neural networks and convolutional neural networks, two key concepts in the area of machine learning. In this hands-on course, instructor Jonathan Fernandes covers fundamental neural and convolutional neural network concepts. Jonathan begins by providing an introduction to the components of neural networks, discussing activation functions and backpropagation. He then looks at convolutional neural networks, explaining why they're particularly good at image recognition tasks. He also steps through how to build a neural network model using Keras. Plus, learn about VGG16, the history of the ImageNet challenge, and more.",Course,2022-07-14 12:28 UTC,N/A,false,N/A,
Creating a Keynote Presentation,"The keynote is a special speech. As the cornerstone of an event, these talks tend to be longer than traditional speeches, more entertaining than strictly educational, and delivered to large audiences. If you've been asked to deliver a keynote, then this course can help by showing you how to plot out and deliver a lively, impactful presentation that drives your message home. Join Todd Dewett as he spells out how to structure your keynote, craft a compelling story, use emotions to enhance your overall message, and prepare to deliver on the day of the event.",Course,2018-08-29 11:11 UTC,N/A,false,N/A,
How Blockchains Will Change Business,"Blockchains are poised to disrupt entrenched industries and shatter conventional business models. Train your brain to see the opportunities and challenges of this next wave of digital change, before the way we do business is again reshaped by new technology. This jargon-free course can help you get up to speed. Join Alison McCauley, the best-selling author of <i>Unblocked: How Blockchains Will Change Your Business (and What to Do about It)</i>, as she goes over what blockchains offer companies, as well as how this technology will impact everything from finance to HR.<br><br>Alison begins by explaining what blockchains accomplish, how they make it safer for everyone to work together, and where they do—and do not—deliver value. Then, she details the new tools that blockchains offer business, including how they can help you discern what's real from what's false in your digital world. Plus, learn how blockchains can impact different departments within your business, from finance to HR.",Course,2021-11-02 15:50 UTC,N/A,false,N/A,
Excel: You Can Do This,"Excel scares a lot of people. Terms like PivotTables, VLOOKUP, and circular references make their heads spin. But once you have a basic grounding in Excel, you can do all these things and more. Follow along with Excel MVP Oz du Soleil in this fast-paced course, as he walks you through features, functions, and commands such as Freeze Panes, Flash Fill, COUNTIFS, and even VLOOKUP. Oz takes the bite out of the most intimidating features in Excel, so you can get more mileage every time you use it.",Course,2020-11-17 22:16 UTC,N/A,false,N/A,
Construction Management: Managing Risk,"<p>Risk is an inherent part of construction and an integral part of the construction manager's job. Over the course of a project, you may have to manage compliance and safety issues, schedule and cost overruns, contract disputes, and more. To be successful, you need to understand the biggest risk factors faced on a job site and how to mitigate them. In this course, OSHA Authorized Outreach Trainer Jim Rogers explains the basics of risk management for construction. Learn how risk changes with the complexity of the project and the type of delivery method being employed. Review your role and the scope of the risk management process, from analysis to control. Along the way, review how technology can help you manage the challenges involved in daily activities using risk analysis and risk mitigation tools. </p><p>This course is part of a <a href=""https://www.linkedin.com/learning/paths/procore-construction-management-professional-certificate"" target=""_blank"">Professional Certificate</a> from Procore.</p>",Course,2021-04-13 13:17 UTC,N/A,false,N/A,
CONTENT METADATA NO LONGER EXISTS - urn:li:lyndaCourse:78,CONTENT METADATA NO LONGER EXISTS - urn:li:lyndaCourse:78,Course,2017-05-20 04:10 UTC,N/A,false,N/A,
B2B Marketing on LinkedIn (2018),"While LinkedIn—the world's largest and most powerful network of professionals—is widely recognized as a top recruiting tool, it also offers features that companies and individuals can leverage for business-to-business (B2B) marketing. In this course, join LinkedIn expert Viveka von Rosen as she shares best practices, tips, and strategies for effectively conducting B2B marketing on the LinkedIn platform. Viveka shares step-by-step actions that individuals on your sales team can take using video, updates, InMail, and other features. She also shares how to leverage Company Pages for B2B marketing, including how to best align marketing campaigns with LinkedIn, increase brand and culture awareness with video, and more.",Course,2020-06-25 15:06 UTC,N/A,true,N/A,
Data Resilience with Spring and RabbitMQ Event Streaming,"RabbitMQ is a widely deployed messaging solution and Spring is a popular framework for building modern Java applications. In this course, Gregory Green explains how Spring and RabbitMQ can be used to build a resilient data architecture for critical applications. Learn about RabbitMQ features such as quorum queues, streams, and multi-site replication. Gregory also reviews Spring projects like Spring Cloud and AMQP that simplify building production-ready applications. Plus, learn how Kubernetes improves resiliency for Spring applications and RabbitMQ.",Course,2025-02-04 08:02 UTC,N/A,false,N/A,
InDesign CC 2015 Essential Training,"InDesign is an essential tool for designers, ad agencies, magazines, newspapers, book publishers, and freelancers around the world. It's used to build everything from traditional print publications to interactive PDFs, digital magazines, and ebooks. This course presents a thorough explanation of the core features and techniques that make this page layout application so powerful, fun, and easy to use.<br><br>

Want to learn InDesign in just 20 minutes? Watch the first chapter, which concentrates on the most essential skills: editing text, adding graphics, moving objects, and creating PDFs. Once you're ready to move on, InDesign insider David Blatner will show you the rest of what InDesign has to offer. Learn how to navigate and customize the workspace, manage documents and pages, format text and graphics, experiment with color and gradients, draw and transform shapes, create interactive documents, package your designs for print, and much more.",Course,2017-05-30 09:02 UTC,N/A,false,N/A,
The Step-by-Step Guide to Building your Thought Leadership on LinkedIn,"Generating business, reaching new clients, or acting as a spokesperson for your company or product—there are many benefits to building your thought leadership on LinkedIn. Whether you are a seasoned professional or just starting out, Alexandra Galviz (""Authentic Alex”) can help. Alex is a Linked Top Voice for the UK and the cofounder of #LinkedInLocal. In this course, she offers a step-by-step guide to using LinkedIn to reach audiences and establish your expertise. She explains how to craft an authentic voice, grow your audience of brand ambassadors, and create courageous content. Each chapter is filled with examples of her favorite thought leaders in the UK, from entrepreneurs to business leaders. By the end, you’ll be sharing your stories in an authentic and relatable way and creating a deeper connection with your network.",Course,2021-01-25 23:40 UTC,N/A,false,N/A,
Nano Tips for Using Excel with Miss Excel (2021),"Welcome to our <i>Nano Tips</i> series, where LinkedIn Learning creators deliver impactful lessons in literally seconds.<br><br>Here, join Miss Excel (aka Kat Norton)—a Microsoft MVP with 750,000+ followers on TikTok—as she shares tips and answers to common questions about Microsoft Excel, all set to a beat. Topics include fixing data in Excel (PivotTable), the filter function in Excel (VLOOKUP), VBA basics in Excel, and more. Each high-energy video offers up quick fixes for things you need to know right now about Excel and also prepares you for more in-depth learning.",Course,2022-07-26 07:13 UTC,N/A,false,N/A,
Word 2019 Essential Training,"Learn how to create, edit, format, and share documents with ease using Microsoft Word 2019. Follow along with David Rivers as he shows all the essential features of this powerful tool. This course covers a variety of topics, including leveraging templates and building blocks to create a stylish document with instant purpose; creating numbered and bulleted lists; working with columns and tables; adding images and shapes to your documents; collaborating on documents with your team; and sharing documents via OneDrive, email, and through other means. Plus, learn how to use the proofing tools in Word to check spelling and grammar, get word counts, and more.",Course,2020-03-21 14:18 UTC,N/A,false,N/A,
CONTENT METADATA NO LONGER EXISTS - urn:li:lyndaCourse:63141,CONTENT METADATA NO LONGER EXISTS - urn:li:lyndaCourse:63141,Course,2016-10-29 14:05 UTC,N/A,false,N/A,
Pixel Playground,"Take a 10-minute recess and join Bert Monroy in Adobe Photoshop or Illustrator, the playgrounds of digital artists. Bert walks through fun, self-contained projects that test your skills and challenge your imagination. Photoshop and Illustrator programs aren't just image or graphic editors; these programs are sandboxes for creativity and experimentation. Take a spin through a carousel of tools and get reinspired.",Course,2018-09-27 06:29 UTC,N/A,false,N/A,
CONTENT METADATA NO LONGER EXISTS - urn:li:lyndaCourse:529633,CONTENT METADATA NO LONGER EXISTS - urn:li:lyndaCourse:529633,Course,2017-07-02 14:22 UTC,N/A,false,N/A,
Delivering an Authentic Elevator Pitch,"Find out how to craft an authentic personal pitch while projecting competence and warmth—two key factors in making a great first impression. Instructor Tatiana Kolovou shares how building trust with people and making a positive first impression isn’t a matter of magic. Tatiana reveals how verbal and nonverbal behaviors can influence the way people react in an initial meeting, whether in person, over the phone, or online.",Course,2020-10-26 00:35 UTC,N/A,false,N/A,
Creating and Managing a YouTube Channel (2018),"By creating and curating a YouTube channel, you can build your online identity as you share your content with the world. In this course, learn how to set up a visually compelling new YouTube channel, build up your subscriber base, and convert clicks into action or commerce. Throughout the course, instructor Rich Harrington shares essential strategies for channel creation. Rich explains how to design artwork for your channel and shares tips for using YouTube cards and captions. He also dives into building a YouTube community, managing your channel in Creator Studio, live streaming, and more.",Course,2018-05-27 12:15 UTC,N/A,false,N/A,
