Content Title,Content Description,Content Type,Content Last Watched Date (if viewed),Content Completed At (if completed),Content Saved,Notes taken on videos (if taken),
Developing a Critical Thinking Mindset,"Critical thinking is often cited as a desirable skill to have, but what exactly does it mean to be a critical thinker, and how does one achieve this mindset? The goal of critical thinking is to give ourselves time and tools for improving how we think, to see things closer to how they really are, and get a better sense of the world. But just understanding the concepts won’t get you there. As Becki Saltzman explains, developing a critical thinking mindset requires commitment and deliberate practice. Becki shows how to put critical thinking knowledge to work to create a mindset that enables you to examine information and determine how to assess information you can trust. She also shows how to develop mental agility to apply insights from one context to the next, ways you can avoid overthinking, and tips on how to balance rational, strategic, and even emotional thinking. After this course, you’ll be on your way to developing the mindset necessary for critical thinking to flourish.",Course,2021-10-03 12:01 UTC,N/A,false,N/A,
Building Relationships While Working from Home,"Working from home removes distractions, but also eliminates important face-to-face interactions. Home-based workers often report feeling disconnected, isolated, and alone. This course teaches us how to create professional yet personal connections with remote team members and how to satisfy that missing element of closeness that people get when they are together at work. Productivity expert Dave Crenshaw explains how to reach out to others, be authentic online, build a great reputation, and make meaningful connections with your peers. These tips are invaluable for anyone working from home—and particularly relevant for those working under the challenging conditions brought about by the COVID-19 pandemic. Take the time to watch this course and invest the time and skills it takes to rekindle your most valuable relationships at work.<br><br>

This course was created by Dave Crenshaw and Invaluable Inc. We are pleased to offer this training in our library.",Course,2020-12-10 09:39 UTC,N/A,false,N/A,
Develop Your Skills as a New Manager,"Develop skills you need to be a successful new manager. After completing this learning path, you'll be able to define your leadership style and build trust with your team, communicate with impact, coach others, set goals, and delegate tasks, while creating a work culture that values belonging.",Learning Path,2020-06-25 14:36 UTC,N/A,false,N/A,
Getting Started with Microsoft Excel,"New to Microsoft Excel? Get up to speed fast with the world's #1 spreadsheet program. In this learning path, you can learn to create and format basic spreadsheets in Excel.",Learning Path,2022-07-22 08:36 UTC,N/A,false,N/A,
Getting Started as an Agile Project Manager,"Deliver projects with the highest level of performance and quality as an agile project manager. This path will help you build a solid foundation in leading and motivating agile project teams, from developing user stories and agile charts to driving productive meetings.",Learning Path,2020-06-25 14:36 UTC,N/A,false,N/A,
Develop Your SEO Skills,"An SEO expert plays a vital role in helping a company build its business. Learn the basics of SEO and grow your skills across key aspects, such as identifying the right tools to meet your needs, keyword strategies, content writing, link-building, optimizing your website, and more.",Learning Path,2020-06-25 14:36 UTC,N/A,false,N/A,
Getting Started as a Project Coordinator,"Kick-start your career in project management as a project coordinator. From project management basics to communication and meeting leadership, you'll learn how to keep project tasks and teams on track in the most efficient ways.",Learning Path,2020-06-25 14:36 UTC,N/A,false,N/A,
Getting Started as a Project Manager,"Project managers have diverse skill sets that allow them to approach projects with strategy and efficiency. After completing this learning path, you'll have the skills and knowledge to manage various types of projects from beginning to end using proven project management techniques.",Learning Path,2020-06-25 14:36 UTC,N/A,false,N/A,
Master Microsoft Excel,Employers around the world cite Microsoft Excel as one of the most sought-after skills for any new hire. This learning path helps you become an Excel power user—covering everything from functions and formatting to PivotTables and dashboards.,Learning Path,2022-04-30 11:40 UTC,N/A,false,N/A,
How to create a community online,"This video explains that communities are a great way to drive ROI for marketing. After watching this video, you will be able to use communities to drive ROI.",Video (3rd Party Provider),2023-12-06 12:36 UTC,N/A,false,N/A,
Introducing Daily,CONTENT DESCRIPTION IS MISSING - urn:li:llsServeVideo:60347605,Video (3rd Party Provider),2023-12-06 12:36 UTC,N/A,false,N/A,
Teacher Tips,"In this course, author and educator Aaron Quigley shows you how to stay up to date with the latest educational technology and classroom management techniques. He introduces you to new tips you can use to be more efficient, and increase student achievement. Aaron covers concepts like the flipped classroom, Common Core Standards, and the role of social media in education. This course also covers a variety of productivity apps, learning management systems, and other technologies, using a project-based approach that simulates the real K–12 or university classroom environment.",Course,2016-09-14 23:58 UTC,N/A,false,N/A,
Social Media Marketing for Small Business (2016),"Small businesses can't afford not to be active on social media. Having a Facebook, Instagram, or Twitter account keeps you tuned into your customer base and helps drive traffic to your website or brick-and-mortar store. Learn what it takes to be successful at social media marketing, without a lot of resources or dedicated marketing staff. Digital and social media strategist Martin Waxman explains the key terms and definitions—everything from SEO to hashtags—and tells you how to start finding your customers online. Learn how to make an action plan that outlines your goals, team, and budget, and find time to implement your ideas. He also talks about what content to publish where and the tools you need to measure the success of your efforts.",Course,2016-10-18 07:20 UTC,N/A,true,N/A,
Stepping Up Your Webcam Video Presence,"Nearly everyone has a webcam, but many people don’t put the effort into enhancing their webcam video presence. But with just a few relatively easy and inexpensive tweaks, you can capture well-composed, well-lit shots with great audio using the humble webcam. In this course, senior staff instructor Ashley Kennedy shows you how to represent your best self in meetings, as well as presentations, trainings, vlogs, interviews, demos, Q&As, and other types of web videos. Learn basic strategies for optimizing your system and your webcam, staging and lighting your shot, capturing high-quality audio, scripting and rehearsing for big-stakes webcam presentations, and more.",Course,2021-06-16 03:18 UTC,N/A,false,N/A,
Animating in Photoshop,"Interested in bringing your line drawings to life? With Adobe Photoshop, you can transform your hand-drawn artwork into compelling animations quickly, avoiding complex specialty software with steep learning curves. Learn how to use Photoshop to make your drawings move in this course with veteran animator Dermot O' Connor. Find out how to draw captivating characters with media brushes, clean up your rough drawings, and add color and inking. Dermot then takes you to the timeline where the animation takes place and shows how to draw the keys, or main poses of an animation; breakdowns; and inbetweens. He also shows how to plot arcs to establish timing and spacing. Finally, learn how to adjust the timing of the final animation and render out the results. By the end of this course, you'll be able to harness this popular software to bring your artwork to life.<br><br>This course was created by Dermot O' Connor. We are pleased to offer this training in our library.",Course,2021-09-06 18:22 UTC,N/A,false,N/A,
Guy Kawasaki on Turning Life Wisdom into Business Success,"Get career advice from a real ""wise guy."" In this course, based on his book <i>Wise Guy</i>, one of the world's leading corporate evangelists, Guy Kawasaki, talks about how he built his career. Learn how he landed his first real job in the jewelry business—which turned out to be surprisingly useful training for the tech world. Find out why some of the riskiest moves he made at Apple—disparaging a potential partner and trading jabs with Steve Jobs—paid off. Guy also reveals how taking up surfing at the age of 62 sparked a new passion. In total, Guy covers everything from moral values to business skills to parenting. As he writes, “I hope my stories help you live a more joyous, productive, and meaningful life. If <i>Wise Guy</i> succeeds at this, then that’s the best story of all.”<br><br>

This course was created by <a href=""https://genconnectu.com/"" target=""_blank"">genconnectU</a>. We are pleased to offer this training in our library.",Course,2021-04-06 11:51 UTC,N/A,false,N/A,
What Is Generative AI?,"<p>Whether you work in film, marketing, healthcare, automobile, or real-estate, generative AI is changing the way your job is executed, and those who adapt early will reap its benefits sooner. All professions will be affected by generative AI. Its invention can be compared to the invention of photography, a true creative revolution. If you want to be part of the leaders that are advancing this revolution, this course can get you started on your learning journey.</p><p>In this course, generative AI expert Pinar Seyhan Demirdag covers the basics of generative AI, with topics including what it is, how it works, how to create your own content, different types of models, future predictions, and ethical implications.</p><p>This course is part of a <a href=""https://www.linkedin.com/learning/paths/career-essentials-in-generative-ai-by-microsoft-and-linkedin"" target=""_blank"">Professional Certificate</a> from Microsoft.</p>",Course,2023-12-05 16:26 UTC,N/A,true,N/A,
SOLIDWORKS 2021 Essential Training,"SOLIDWORKS is the premier product-design software—enabling you to deliver innovative solutions to market faster. In this course, Gabriel Corbett teaches you how to build ready-to-manufacture parts and assemblies as well as detailed drawings and itemized bills of materials in SOLIDWORKS 2021. Learn how to create 2D sketches and then extrude, revolve, loft, and sweep these features into 3D objects. Find out how to make cuts and create standard holes, and explore more advanced modeling techniques using blocks, mirroring, and the SOLIDWORKS pattern tools. Then review best practices for putting parts together in assemblies and creating detailed drawings. Along the way, Gabriel highlights new features from the 2021 release, as well as features designed for users with pen or touch devices.",Course,2021-08-19 07:19 UTC,N/A,false,N/A,
AutoCAD 2016 Essential Training,"Scott Onstott has been using AutoCAD for 24 years and has witnessed its evolution into the most popular industry-standard computer-aided drafting and design application. This course is your detailed introduction to the 2016 version of AutoCAD. Scott begins with the basics of the user interface and leads you step-by-step to learning how to draw the kind of precise, measured 2D drawings that form the basis of design communication the world over. Along the way, you'll learn how to create and modify geometry, layers, blocks, attributes, dimensions, layouts, and how to share your drawings with others.<br><br>

Note: The course is an update to our 2015 training, including new movies on working with object snaps, writing multiline objects, making dimension objects, and more.",Course,2016-09-07 13:58 UTC,N/A,false,N/A,
How to Confidently Negotiate Your Salary,"Learn how to confidently negotiate your salary and ask for what you are worth. In this course, adapted from the American Negotiation Institute podcast <em>Negotiate Anything</em>, Kwame Christian joins Meggie Palmer to discuss the topic of salary negotiation. Meggie is the founder and CEO of <a href=""https://www.peptalkher.com/"" target=""_blank"">PepTalkHer</a>, a tech-coaching program empowering women and helping companies close the gender gap. Learn how to gain confidence through preparation, recognize your value, negotiate in the job you have now, and take the time you need when you’re considering an offer from a new company. These tips will help you get the salary and benefits package you deserve—no matter your position.<br><br>

This course was created by the American Negotiation Institute. We are pleased to offer this training in our library.",Course,2021-08-03 17:20 UTC,N/A,false,N/A,
CONTENT METADATA NO LONGER EXISTS - urn:li:lyndaCourse:410333,CONTENT METADATA NO LONGER EXISTS - urn:li:lyndaCourse:410333,Course,2016-06-12 09:22 UTC,N/A,false,N/A,
Learning Personal Branding,"You are the most powerful marketing tool at your disposal. If you are starting a business, establishing your thought leadership, or trying to get ahead in your career, it's a great time to start investing in the brand of you. Learn the secrets of personal branding in this course with marketing expert Chelsea Krost. Chelsea explains how to develop your story, craft your messaging, and define your audience. Then she walks you through building your brand presence online and off, creating a calendar that will help you stay on top of social media and keep your content fresh. Plus, get tips to monetize your personal brand and land speaking engagements and guest roles.",Course,2020-10-29 12:58 UTC,N/A,false,N/A,
Learning Bluebeam Revu: Version 2018 to Version 20,"Explore the essentials of Bluebeam Revu, the PDF collaboration program designed specifically for the architecture, engineering, and construction (AEC) industry. For the designer and detailer, Bluebeam Revu includes plugins for most computer-aided design (CAD) and building information modeling (BIM) software that enables quick and easy conversion of both 2D and 3D drawings into a PDF file that can be easily viewed by the entire project team. For the construction professional, it includes sketch, markup, measurement, and takeoff tools as well as powerful search features specifically designed to work with construction documents.",Course,2021-07-15 14:31 UTC,N/A,false,N/A,
Personal Effectiveness Tips,"Before you affect change in your role or organization, you need to develop and manage yourself. In this series, personal branding and career expert Dorie Clark shares research-based best practices to help you establish your credibility, identify your leadership blind spots, deal with change, find mentors and sponsors to guide you, and more.",Course,2018-04-23 15:37 UTC,N/A,false,N/A,
Modeling a Cabinet with SOLIDWORKS,"Improve your top-down or in-context assembly design skills using a ""skeleton modeling"" strategy and SOLIDWORKS. In this course, Leon van den Heever shows how to create a model of a cabinet that automatically resizes its components based on the outer skeletal structure. This start-to-finish project will help you practice your assembly design skills and master the impressive modeling tools in SOLIDWORKS.",Course,2016-10-12 16:30 UTC,N/A,false,N/A,
Ethical Hacking: The Complete Malware Analysis Process,"<p>The key to effectively protecting your systems is understanding the attacks you have to defend them against. Join instructor Malcolm Shore for a hands-on introduction to the many different types of malware that can be used to exploit a target computer.</p> 
<p><b>Explore ethical hacking strategies to:</b></p>
<ul>
<li>Protect your data from different types of malware including viruses, worms, Trojans, and backdoors.</li> 
<li>Identify places where malware hides and detect it to protect your networks and systems against cyberattacks.</li>
<li>Reverse-engineer malware to understand how it operates.</li> 
<li>Identify malware construction kits called “botnets,” which are used to automate malware.</li> 
<li>Understand the use of cryptography in ransomware.</li>
<li>Analyze Win32.Sodin, Log4Shell, Black Energy, and Grey Energy droppers and packers.</li> 
<li>Utilize open-source malware analysis tools such as MITRE ATT$CK and Ghidra.</li>
</ul>",Course,2024-11-18 09:58 UTC,N/A,false,N/A,
Time Management Tips,"Improve your productivity, get things done, and find more time for what's most important with <i>Time Management Tips</i>. This series provides actionable time management advice in just a few short minutes.<br><br>Productivity expert Dave Crenshaw provides techniques on a wide variety of topics, designed to help people better manage their time and ultimately become more productive. Tune in to learn about everything from managing emails and calendars to setting priorities, collaborating with coworkers, reducing interruptions, crafting a ""productivity mindset,"" and creating a more comfortable and effective work environment.<br><br> 

Have an idea for a future video from Dave? Submit it using our course feedback form. If you want more time management strategies now, we recommend watching Dave's <i>Time Management Fundamentals</i> course.<br><br>",Course,2018-04-23 21:40 UTC,N/A,false,N/A,
How to Become a Thought Leader and Advance Your Career,"Building thought leadership can provide a crucial advantage for active job seekers and those looking to advance their careers. What does it mean to be a thought leader, though? In this course, career strategist Jenny Foss explains what thought leadership is, why it matters, and how you can use it to become a go-to voice in your industry or area of expertise. Jenny walks you through how to establish your personal branding, identify your own style, and create and share your own written, audio, and video content. If creating content doesn’t appeal to you, Jenny shows you how becoming a content curator can also help you build thought leadership. She discusses how to seek out speaking opportunities, then concludes with several useful best practices.",Course,2021-09-15 22:41 UTC,N/A,false,N/A,
Vocal Production for Voice-Overs and Podcasts,"Whether you’re making a podcast, audiobook, voice-over tracks, or any other type of vocal content, it’s easier than ever to record your own vocal productions. In this course, Evan Sutton shows you how to optimize your recording space and setup to make sure your recording process goes smoothly and produces content that sounds great. He starts with the basics, like choosing the best microphone for your content and prepping your space. He then gets into setting up your DAW and staging tips like microphone placement and preamp settings. Evan also shows you how to edit your vocal tracks after recording, and includes tips for seamlessly editing takes together, and using plugins to remove background noise. Lastly, he gets into mixing, exporting, and the final processing of your vocal tracks.",Course,2025-01-27 21:09 UTC,N/A,false,N/A,
Sheryl Sandberg and Adam Grant on Option B: Building Resilience,"Dodging adversity is often not a choice. Encountering a devastating event—the gut-wrenching kind that zaps away joy—is an inevitability of life. In their <em>New York Times</em> best-selling book <em>Option B: Facing Adversity, Building Resilience, and Finding Joy</em>, Facebook COO Sheryl Sandberg and Wharton psychologist Adam Grant share their insights on building resilience in the face of such setbacks. They offer practical steps you can take to reimagine and rebuild your life when your first choice—your Option A—is no longer on the table, and you're faced with the task of making the absolute best of Option B. This course highlights some of the powerful topics in this book, including how to talk to friends and colleagues who are hurting when you're not sure what to say, how to fight the idea that the hurt you're feeling is permanent, and how to give yourself permission to experience happiness again.<br><br> For additional resources and support, check out <a href=""https://optionb.org/"" target=""_blank""> OptionB.Org</a>, a nonprofit initiative dedicated to helping individuals build resilience in the face of adversity.",Course,2020-11-20 05:03 UTC,N/A,false,N/A,
WordPress 4 Essential Training,"WordPress powers millions of blogs and websites. Learn how to create your own with this powerful publishing platform. Staff author Morten Rand-Hendriksen will help you get the most out of the self-hosted version of WordPress and create feature-rich blogs and websites. Morten explains how to create and publish posts and pages; customize your site with themes, widgets, and custom menus; and extend WordPress even further with plugins. Plus, learn how to get more readers with social media sharing and comments, and how to adjust the settings that keep your site safe and secure.<br><br>Note: This course covers an older version of WordPress, which features the Classic Editor. Watch this course only if you are using the Classic Editor plugin or using WordPress 4.9 or earlier. Otherwise, watch <i>WordPress 5 Essential Training</i>, which covers the new Block Editor experience.",Course,2016-06-05 12:53 UTC,N/A,false,N/A,
Excel Modeling Tips and Tricks (2021),"Excel is the most widely used data analysis software on the market, but many people in business are not using it to its full potential. Excel can be a great tool for building financial and operational models, allowing users to understand what may happen in the future and how the business can position itself. In this course, learn how to build effective and useful financial models in Excel to forecast sales and costs, profits, operational KPIs, business assets and liabilities, and much more. Instructor Michael McDonald covers rules and best practices for financial modeling and then shows how to set up single-sheet and multi-sheet financial models and add inputs and assumptions, external data, projections, and more. Plus, learn how to determine the accuracy and strength of your models and keep them up to date as the data evolves. By the end of this course, you will have the tools and tricks you need to become a master of Excel modeling for businesses ranging from restaurants and manufacturing firms to banks and software companies.",Course,2021-06-26 13:05 UTC,N/A,false,N/A,
Staying Positive in the Face of Negativity,"Even the most optimistic of us can get weighed down when seemingly unrelenting negativity swirls around us at work and in life. It impacts our perspective, presence, and performance. Self-leadership expert Scott Mautz teaches a specific plan for fostering sustainable positivity, especially in the face of tiresome negativity. You’ll be able to stay positive over the long haul by applying fundamentals of positivity—like staying grounded and practicing a special type of gratitude—and by drawing optimism from increased mental strength. Learn to build specialized positivity skills—such as handling criticism and difficult people—and build daily habits of positivity too. Plus, hear real-world examples and craft a personal MAP (micro action plan) for being realistic but staying upbeat when it feels like the world is conspiring to keep you down.",Course,2021-09-01 11:33 UTC,N/A,false,N/A,
"Business Etiquette: Phone, Email, and Text (2015)","Phone, email, or text? Learn what communication method to use when. Suzanna Kaye starts with email, explaining everything from setting up signatures to striking the right tone. She also explains how to best use autoresponders, acknowledge receipt of an email, and follow up on unanswered email. The lessons help viewers evaluate their own email communications, ensuring that the recipients won't misinterpret them in any way.<br><br>

Next up is text etiquette, including what and what not to say in a text message. Suzanna then looks at common business communications like letters, requests for payment, and thank-yous, and how to make action items communicate the right level of urgency.<br><br>

Finally, the course covers phone etiquette, including proper greetings, voicemails, out-of-office messages, and essential phone behavior.",Course,2018-10-06 14:29 UTC,N/A,false,N/A,
Animating in Historical Styles,"Do you create 2D animation or study classic animation styles? In this course, instructor Dermot O’Connor gives professional insights on several historical styles. First, Dermot talks about the differences between a surface style of a period and reproducing the essence of it. Then he goes over the technical factors, animation methods, techniques, and post-production effects for 1920s rubber hose animation. Next, Dermot does the same for 1940’s Looney Toons style animation, 1960s TV animation, and 1980s Saturday morning cartoon animation. He concludes with a thorough comparison of Bluth and Disney animations in the 1970s and 1980s and how you can approach each style.",Course,2021-12-26 14:57 UTC,N/A,false,N/A,
